{
  "schema_version": "1.0",
  "fixture_only": true,
  "id": "fixture:ink:1",
  "snapshot_id": "fixture:snapshot:1",
  "coordinate_space_id": "fixture:coordinates:1",
  "strokes": [
    {
      "id": "stroke-1",
      "tool": "highlighter",
      "brush_version": "fixture-1",
      "width": 12,
      "color": "#FFE066",
      "opacity": 0.35,
      "points": [
        {
          "x": 40,
          "y": 88,
          "pressure": 0.5,
          "elapsed_ms": 0
        },
        {
          "x": 260,
          "y": 88,
          "pressure": 0.5,
          "elapsed_ms": 200
        }
      ]
    }
  ],
  "deleted_stroke_ids": [],
  "viewport_transform": {
    "scale": 1,
    "translate_x": 0,
    "translate_y": 0
  }
}
